### ISSUE TITLE
HTTP/2 is not working in Vert.x 3.5.2 Version, when 2 requests are sent

### ISSUE THREAD

**Issue by michaelpog** [vert-x3/issues#387]
In Vert.x 3.5.2 when I set up a groovy HTTP server and Java HTTP client, and try to send 2 consecutive HTTP post requests through HTTP/2, only the first request gets a response.
Here is the reproducer
https://github.com/michaelpog/http2reproducer

If you switch the version of Vert.x to 3.5.1 and below, the issue does not occur.

Example of tcpdump with 3.5.2:
```
sudo tcpdump -A -i any dst port 8888 or src port 8888
tcpdump: data link type PKTAP
tcpdump: verbose output suppressed, use -v or -vv for full protocol decode
listening on any, link-type PKTAP (Apple DLT_PKTAP), capture size 262144 bytes
16:41:08.259729 IP localhost.62704 > localhost.ddi-tcp-1: Flags [S], seq 2979902556, win 65535, options [mss 16344,nop,wscale 5,nop,nop,TS val 508479710 ecr 0,sackOK,eol], length 0
....E..@.O@.@............."....\.........4....?........
.N..........
16:41:08.259742 IP localhost.62704 > localhost.ddi-tcp-1: Flags [S], seq 2979902556, win 65535, options [mss 16344,nop,wscale 5,nop,nop,TS val 508479710 ecr 0,sackOK,eol], length 0
....E..@.O@.@............."....\.........4....?........
.N..........
16:41:08.259826 IP localhost.ddi-tcp-1 > localhost.62704: Flags [S.], seq 4232357904, ack 2979902557, win 65535, options [mss 16344,nop,wscale 5,nop,nop,TS val 508479710 ecr 508479710,sackOK,eol], length 0
....E..@.t@.@..........."....D.....].....4....?........
.N...N......
16:41:08.259830 IP localhost.ddi-tcp-1 > localhost.62704: Flags [S.], seq 4232357904, ack 2979902557, win 65535, options [mss 16344,nop,wscale 5,nop,nop,TS val 508479710 ecr 508479710,sackOK,eol], length 0
....E..@.t@.@..........."....D.....].....4....?........
.N...N......
16:41:08.259837 IP localhost.62704 > localhost.ddi-tcp-1: Flags [.], ack 1, win 12759, options [nop,nop,TS val 508479710 ecr 508479710], length 0
....E..4.E@.@............."....].D....1..(.....
.N...N..
16:41:08.259839 IP localhost.62704 > localhost.ddi-tcp-1: Flags [.], ack 1, win 12759, options [nop,nop,TS val 508479710 ecr 508479710], length 0
....E..4.E@.@............."....].D....1..(.....
.N...N..
16:41:08.259850 IP localhost.ddi-tcp-1 > localhost.62704: Flags [.], ack 1, win 12759, options [nop,nop,TS val 508479710 ecr 508479710], length 0
....E..4.	@.@..........."....D.....]..1..(.....
.N...N..
16:41:08.259851 IP localhost.ddi-tcp-1 > localhost.62704: Flags [.], ack 1, win 12759, options [nop,nop,TS val 508479710 ecr 508479710], length 0
....E..4.	@.@..........."....D.....]..1..(.....
.N...N..
16:41:08.306581 IP localhost.62704 > localhost.ddi-tcp-1: Flags [P.], seq 1:161, ack 1, win 12759, options [nop,nop,TS val 508479755 ecr 508479710], length 160
....E.....@.@............."....].D....1........
.N...N..POST /some_endpoint HTTP/1.1
Content-Length: 18
Host: localhost:8888
upgrade: h2c
HTTP2-Settings:
connection: HTTP2-Settings,upgrade

hi from client - 1
16:41:08.306592 IP localhost.62704 > localhost.ddi-tcp-1: Flags [P.], seq 1:161, ack 1, win 12759, options [nop,nop,TS val 508479755 ecr 508479710], length 160
....E.....@.@............."....].D....1........
.N...N..POST /some_endpoint HTTP/1.1
Content-Length: 18
Host: localhost:8888
upgrade: h2c
HTTP2-Settings:
connection: HTTP2-Settings,upgrade

hi from client - 1
16:41:08.306609 IP localhost.ddi-tcp-1 > localhost.62704: Flags [.], ack 161, win 12754, options [nop,nop,TS val 508479755 ecr 508479755], length 0
....E..4..@.@..........."....D........1..(.....
.N...N..
16:41:08.306612 IP localhost.ddi-tcp-1 > localhost.62704: Flags [.], ack 161, win 12754, options [nop,nop,TS val 508479755 ecr 508479755], length 0
....E..4..@.@..........."....D........1..(.....
.N...N..
16:41:08.358291 IP localhost.ddi-tcp-1 > localhost.62704: Flags [P.], seq 1:91, ack 161, win 12754, options [nop,nop,TS val 508479806 ecr 508479755], length 90
....E.....@.@..........."....D........1........
.N.>.N..HTTP/1.1 101 Switching Protocols
connection: upgrade
upgrade: h2c
content-length: 0


16:41:08.358309 IP localhost.ddi-tcp-1 > localhost.62704: Flags [P.], seq 1:91, ack 161, win 12754, options [nop,nop,TS val 508479806 ecr 508479755], length 90
....E.....@.@..........."....D........1........
.N.>.N..HTTP/1.1 101 Switching Protocols
connection: upgrade
upgrade: h2c
content-length: 0


16:41:08.358333 IP localhost.62704 > localhost.ddi-tcp-1: Flags [.], ack 91, win 12756, options [nop,nop,TS val 508479806 ecr 508479806], length 0
....E..4	.@.@............."......D.k..1..(.....
.N.>.N.>
16:41:08.358341 IP localhost.62704 > localhost.ddi-tcp-1: Flags [.], ack 91, win 12756, options [nop,nop,TS val 508479806 ecr 508479806], length 0
....E..4	.@.@............."......D.k..1..(.....
.N.>.N.>
16:41:08.407396 IP localhost.62704 > localhost.ddi-tcp-1: Flags [P.], seq 161:200, ack 91, win 12756, options [nop,nop,TS val 508479854 ecr 508479806], length 39
....E..[.t@.@............."......D.k..1..O.....
.N.n.N.>PRI * HTTP/2.0

SM

............. .
16:41:08.407424 IP localhost.62704 > localhost.ddi-tcp-1: Flags [P.], seq 161:200, ack 91, win 12756, options [nop,nop,TS val 508479854 ecr 508479806], length 39
....E..[.t@.@............."......D.k..1..O.....
.N.n.N.>PRI * HTTP/2.0

SM

............. .
16:41:08.407440 IP localhost.ddi-tcp-1 > localhost.62704: Flags [.], ack 200, win 12753, options [nop,nop,TS val 508479854 ecr 508479854], length 0
....E..4.L@.@..........."....D.k...$..1..(.....
.N.n.N.n
16:41:08.407443 IP localhost.ddi-tcp-1 > localhost.62704: Flags [.], ack 200, win 12753, options [nop,nop,TS val 508479854 ecr 508479854], length 0
....E..4.L@.@..........."....D.k...$..1..(.....
.N.n.N.n
16:41:08.444129 IP localhost.ddi-tcp-1 > localhost.62704: Flags [P.], seq 91:147, ack 200, win 12753, options [nop,nop,TS val 508479890 ecr 508479854], length 56
....E..l..@.@..........."....D.k...$..1..`.....
.N...N.n..............d.... ...	.$..........\.8.........response
16:41:08.444145 IP localhost.ddi-tcp-1 > localhost.62704: Flags [P.], seq 91:147, ack 200, win 12753, options [nop,nop,TS val 508479890 ecr 508479854], length 56
....E..l..@.@..........."....D.k...$..1..`.....
.N...N.n..............d.... ...	.$..........\.8.........response
16:41:08.444165 IP localhost.62704 > localhost.ddi-tcp-1: Flags [.], ack 147, win 12754, options [nop,nop,TS val 508479890 ecr 508479890], length 0
....E..4.j@.@............."....$.D....1..(.....
.N...N..
16:41:08.444169 IP localhost.62704 > localhost.ddi-tcp-1: Flags [.], ack 147, win 12754, options [nop,nop,TS val 508479890 ecr 508479890], length 0
....E..4.j@.@............."....$.D....1..(.....
.N...N..
16:41:08.460686 IP localhost.62704 > localhost.ddi-tcp-1: Flags [P.], seq 200:209, ack 147, win 12754, options [nop,nop,TS val 508479906 ecr 508479890], length 9
....E..=f.@.@............."....$.D....1..1.....
.N...N...........
16:41:08.460700 IP localhost.62704 > localhost.ddi-tcp-1: Flags [P.], seq 200:209, ack 147, win 12754, options [nop,nop,TS val 508479906 ecr 508479890], length 9
....E..=f.@.@............."....$.D....1..1.....
.N...N...........
16:41:08.460713 IP localhost.ddi-tcp-1 > localhost.62704: Flags [.], ack 209, win 12752, options [nop,nop,TS val 508479906 ecr 508479906], length 0
....E..4..@.@..........."....D.....-..1..(.....
.N...N..
16:41:08.460716 IP localhost.ddi-tcp-1 > localhost.62704: Flags [.], ack 209, win 12752, options [nop,nop,TS val 508479906 ecr 508479906], length 0
....E..4..@.@..........."....D.....-..1..(.....
.N...N..
16:41:08.464669 IP localhost.62704 > localhost.ddi-tcp-1: Flags [P.], seq 209:280, ack 147, win 12754, options [nop,nop,TS val 508479909 ecr 508479906], length 71
....E..{..@.@............."....-.D....1..o.....
.N...N....#.$..........D.a.....+9.O.A......	...=\.18.........hi from client - 2
16:41:08.464682 IP localhost.62704 > localhost.ddi-tcp-1: Flags [P.], seq 209:280, ack 147, win 12754, options [nop,nop,TS val 508479909 ecr 508479906], length 71
....E..{..@.@............."....-.D....1..o.....
.N...N....#.$..........D.a.....+9.O.A......	...=\.18.........hi from client - 2
16:41:08.464695 IP localhost.ddi-tcp-1 > localhost.62704: Flags [.], ack 280, win 12750, options [nop,nop,TS val 508479909 ecr 508479909], length 0
....E..4`I@.@..........."....D.....t..1..(.....
.N...N..
16:41:08.464697 IP localhost.ddi-tcp-1 > localhost.62704: Flags [.], ack 280, win 12750, options [nop,nop,TS val 508479909 ecr 508479909], length 0
....E..4`I@.@..........."....D.....t..1..(.....
.N...N..
```
Output from client:
```
Got response 200 with protocol HTTP_2
Got data response
```

tcpdump from running with 3.5.1:
```
sudo tcpdump -A -i any dst port 8888 or src port 8888
tcpdump: data link type PKTAP
tcpdump: verbose output suppressed, use -v or -vv for full protocol decode
listening on any, link-type PKTAP (Apple DLT_PKTAP), capture size 262144 bytes
16:43:56.219525 IP localhost.62815 > localhost.ddi-tcp-1: Flags [SEW], seq 962973639, win 65535, options [mss 16344,nop,wscale 5,nop,nop,TS val 508646498 ecr 0,sackOK,eol], length 0
....E..@..@.@............_".9e...........4....?........
.QTb........
16:43:56.219550 IP localhost.62815 > localhost.ddi-tcp-1: Flags [SEW], seq 962973639, win 65535, options [mss 16344,nop,wscale 5,nop,nop,TS val 508646498 ecr 0,sackOK,eol], length 0
....E..@..@.@............_".9e...........4....?........
.QTb........
16:43:56.219624 IP localhost.ddi-tcp-1 > localhost.62815: Flags [S.E], seq 641915410, ack 962973640, win 65535, options [mss 16344,nop,wscale 5,nop,nop,TS val 508646498 ecr 508646498,sackOK,eol], length 0
....E..@..@.@...........".._&B..9e...R...4....?........
.QTb.QTb....
16:43:56.219627 IP localhost.ddi-tcp-1 > localhost.62815: Flags [S.E], seq 641915410, ack 962973640, win 65535, options [mss 16344,nop,wscale 5,nop,nop,TS val 508646498 ecr 508646498,sackOK,eol], length 0
....E..@..@.@...........".._&B..9e...R...4....?........
.QTb.QTb....
16:43:56.219634 IP localhost.62815 > localhost.ddi-tcp-1: Flags [.], ack 1, win 12759, options [nop,nop,TS val 508646498 ecr 508646498], length 0
....E..4.!@.@............_".9e..&B....1..(.....
.QTb.QTb
16:43:56.219635 IP localhost.62815 > localhost.ddi-tcp-1: Flags [.], ack 1, win 12759, options [nop,nop,TS val 508646498 ecr 508646498], length 0
....E..4.!@.@............_".9e..&B....1..(.....
.QTb.QTb
16:43:56.219647 IP localhost.ddi-tcp-1 > localhost.62815: Flags [.], ack 1, win 12759, options [nop,nop,TS val 508646498 ecr 508646498], length 0
....E..4f.@.@...........".._&B..9e....1..(.....
.QTb.QTb
16:43:56.219648 IP localhost.ddi-tcp-1 > localhost.62815: Flags [.], ack 1, win 12759, options [nop,nop,TS val 508646498 ecr 508646498], length 0
....E..4f.@.@...........".._&B..9e....1..(.....
.QTb.QTb
16:43:56.240174 IP localhost.62815 > localhost.ddi-tcp-1: Flags [P.], seq 1:109, ack 1, win 12759, options [nop,nop,TS val 508646517 ecr 508646498], length 108
....E.....@.@............_".9e..&B....1........
.QTu.QTbGET / HTTP/1.1
host: localhost:8888
upgrade: h2c
HTTP2-Settings:
connection: HTTP2-Settings,upgrade


16:43:56.240196 IP localhost.62815 > localhost.ddi-tcp-1: Flags [P.], seq 1:109, ack 1, win 12759, options [nop,nop,TS val 508646517 ecr 508646498], length 108
....E.....@.@............_".9e..&B....1........
.QTu.QTbGET / HTTP/1.1
host: localhost:8888
upgrade: h2c
HTTP2-Settings:
connection: HTTP2-Settings,upgrade


16:43:56.240217 IP localhost.ddi-tcp-1 > localhost.62815: Flags [.], ack 109, win 12756, options [nop,nop,TS val 508646517 ecr 508646517], length 0
....E..4..@.@...........".._&B..9e.4..1..(.....
.QTu.QTu
16:43:56.240220 IP localhost.ddi-tcp-1 > localhost.62815: Flags [.], ack 109, win 12756, options [nop,nop,TS val 508646517 ecr 508646517], length 0
....E..4..@.@...........".._&B..9e.4..1..(.....
.QTu.QTu
16:43:56.291185 IP localhost.ddi-tcp-1 > localhost.62815: Flags [P.], seq 1:91, ack 109, win 12756, options [nop,nop,TS val 508646566 ecr 508646517], length 90
....E.....@.@...........".._&B..9e.4..1........
.QT..QTuHTTP/1.1 101 Switching Protocols
connection: upgrade
upgrade: h2c
content-length: 0


16:43:56.291203 IP localhost.ddi-tcp-1 > localhost.62815: Flags [P.], seq 1:91, ack 109, win 12756, options [nop,nop,TS val 508646566 ecr 508646517], length 90
....E.....@.@...........".._&B..9e.4..1........
.QT..QTuHTTP/1.1 101 Switching Protocols
connection: upgrade
upgrade: h2c
content-length: 0


16:43:56.291223 IP localhost.62815 > localhost.ddi-tcp-1: Flags [.], ack 91, win 12756, options [nop,nop,TS val 508646566 ecr 508646566], length 0
....E..4..@.@............_".9e.4&B.m..1..(.....
.QT..QT.
16:43:56.291226 IP localhost.62815 > localhost.ddi-tcp-1: Flags [.], ack 91, win 12756, options [nop,nop,TS val 508646566 ecr 508646566], length 0
....E..4..@.@............_".9e.4&B.m..1..(.....
.QT..QT.
16:43:56.323657 IP localhost.ddi-tcp-1 > localhost.62815: Flags [P.], seq 91:112, ack 109, win 12756, options [nop,nop,TS val 508646597 ecr 508646566], length 21
....E..I..@.@...........".._&B.m9e.4..1..=.....
.QT..QT...............d.... .
16:43:56.323679 IP localhost.ddi-tcp-1 > localhost.62815: Flags [P.], seq 91:112, ack 109, win 12756, options [nop,nop,TS val 508646597 ecr 508646566], length 21
....E..I..@.@...........".._&B.m9e.4..1..=.....
.QT..QT...............d.... .
16:43:56.323695 IP localhost.62815 > localhost.ddi-tcp-1: Flags [.], ack 112, win 12755, options [nop,nop,TS val 508646597 ecr 508646597], length 0
....E..4:.@.@............_".9e.4&B....1..(.....
.QT..QT.
16:43:56.323698 IP localhost.62815 > localhost.ddi-tcp-1: Flags [.], ack 112, win 12755, options [nop,nop,TS val 508646597 ecr 508646597], length 0
....E..4:.@.@............_".9e.4&B....1..(.....
.QT..QT.
16:43:56.335924 IP localhost.62815 > localhost.ddi-tcp-1: Flags [P.], seq 109:148, ack 112, win 12755, options [nop,nop,TS val 508646609 ecr 508646597], length 39
....E..[F.@.@............_".9e.4&B....1..O.....
.QT..QT.PRI * HTTP/2.0

SM

............. .
16:43:56.335956 IP localhost.62815 > localhost.ddi-tcp-1: Flags [P.], seq 109:148, ack 112, win 12755, options [nop,nop,TS val 508646609 ecr 508646597], length 39
....E..[F.@.@............_".9e.4&B....1..O.....
.QT..QT.PRI * HTTP/2.0

SM

............. .
16:43:56.335973 IP localhost.ddi-tcp-1 > localhost.62815: Flags [.], ack 148, win 12754, options [nop,nop,TS val 508646609 ecr 508646609], length 0
....E..4..@.@...........".._&B..9e.[..1..(.....
.QT..QT.
16:43:56.335976 IP localhost.ddi-tcp-1 > localhost.62815: Flags [.], ack 148, win 12754, options [nop,nop,TS val 508646609 ecr 508646609], length 0
....E..4..@.@...........".._&B..9e.[..1..(.....
.QT..QT.
16:43:56.339552 IP localhost.ddi-tcp-1 > localhost.62815: Flags [P.], seq 112:121, ack 148, win 12754, options [nop,nop,TS val 508646612 ecr 508646609], length 9
....E..=..@.@...........".._&B..9e.[..1..1.....
.QT..QT..........
16:43:56.339581 IP localhost.ddi-tcp-1 > localhost.62815: Flags [P.], seq 112:121, ack 148, win 12754, options [nop,nop,TS val 508646612 ecr 508646609], length 9
....E..=..@.@...........".._&B..9e.[..1..1.....
.QT..QT..........
16:43:56.339595 IP localhost.62815 > localhost.ddi-tcp-1: Flags [.], ack 121, win 12755, options [nop,nop,TS val 508646612 ecr 508646612], length 0
....E..4..@.@............_".9e.[&B....1..(.....
.QT..QT.
16:43:56.339597 IP localhost.62815 > localhost.ddi-tcp-1: Flags [.], ack 121, win 12755, options [nop,nop,TS val 508646612 ecr 508646612], length 0
....E..4..@.@............_".9e.[&B....1..(.....
.QT..QT.
16:43:56.350503 IP localhost.62815 > localhost.ddi-tcp-1: Flags [P.], seq 148:228, ack 121, win 12755, options [nop,nop,TS val 508646622 ecr 508646612], length 80
....E...J.@.@............_".9e.[&B....1..x.....
.QT..QT............#.$..........D.a.....+9.O.A......	...=\.18.........hi from client - 1
16:43:56.350528 IP localhost.62815 > localhost.ddi-tcp-1: Flags [P.], seq 148:228, ack 121, win 12755, options [nop,nop,TS val 508646622 ecr 508646612], length 80
....E...J.@.@............_".9e.[&B....1..x.....
.QT..QT............#.$..........D.a.....+9.O.A......	...=\.18.........hi from client - 1
16:43:56.350544 IP localhost.ddi-tcp-1 > localhost.62815: Flags [.], ack 228, win 12752, options [nop,nop,TS val 508646622 ecr 508646622], length 0
....E..4H.@.@...........".._&B..9e....1..(.....
.QT..QT.
16:43:56.350547 IP localhost.ddi-tcp-1 > localhost.62815: Flags [.], ack 228, win 12752, options [nop,nop,TS val 508646622 ecr 508646622], length 0
....E..4H.@.@...........".._&B..9e....1..(.....
.QT..QT.
16:43:56.351672 IP localhost.62815 > localhost.ddi-tcp-1: Flags [P.], seq 228:274, ack 121, win 12755, options [nop,nop,TS val 508646623 ecr 508646622], length 46
....E..b5=@.@............_".9e..&B....1..V.....
.QT..QT...
.$.......................hi from client - 2
16:43:56.351691 IP localhost.62815 > localhost.ddi-tcp-1: Flags [P.], seq 228:274, ack 121, win 12755, options [nop,nop,TS val 508646623 ecr 508646622], length 46
....E..b5=@.@............_".9e..&B....1..V.....
.QT..QT...
.$.......................hi from client - 2
16:43:56.351703 IP localhost.ddi-tcp-1 > localhost.62815: Flags [.], ack 274, win 12750, options [nop,nop,TS val 508646623 ecr 508646623], length 0
....E..4.U@.@...........".._&B..9e....1..(.....
.QT..QT.
16:43:56.351706 IP localhost.ddi-tcp-1 > localhost.62815: Flags [.], ack 274, win 12750, options [nop,nop,TS val 508646623 ecr 508646623], length 0
....E..4.U@.@...........".._&B..9e....1..(.....
.QT..QT.
16:43:56.394457 IP localhost.ddi-tcp-1 > localhost.62815: Flags [P.], seq 121:156, ack 274, win 12750, options [nop,nop,TS val 508646665 ecr 508646623], length 35
....E..W{.@.@...........".._&B..9e....1..K.....
.QU	.QT...	.$..........\.8.........response
16:43:56.394483 IP localhost.ddi-tcp-1 > localhost.62815: Flags [P.], seq 121:156, ack 274, win 12750, options [nop,nop,TS val 508646665 ecr 508646623], length 35
....E..W{.@.@...........".._&B..9e....1..K.....
.QU	.QT...	.$..........\.8.........response
16:43:56.394501 IP localhost.62815 > localhost.ddi-tcp-1: Flags [.], ack 156, win 12754, options [nop,nop,TS val 508646665 ecr 508646665], length 0
....E..4..@.@............_".9e..&B....1..(.....
.QU	.QU
16:43:56.394503 IP localhost.62815 > localhost.ddi-tcp-1: Flags [.], ack 156, win 12754, options [nop,nop,TS val 508646665 ecr 508646665], length 0
....E..4..@.@............_".9e..&B....1..(.....
.QU	.QU
16:43:56.396223 IP localhost.ddi-tcp-1 > localhost.62815: Flags [P.], seq 156:189, ack 274, win 12750, options [nop,nop,TS val 508646666 ecr 508646665], length 33
....E..U.e@.@...........".._&B..9e....1..I.....
.QU
.QU	....$....................response
16:43:56.396235 IP localhost.ddi-tcp-1 > localhost.62815: Flags [P.], seq 156:189, ack 274, win 12750, options [nop,nop,TS val 508646666 ecr 508646665], length 33
....E..U.e@.@...........".._&B..9e....1..I.....
.QU
.QU	....$....................response
16:43:56.396243 IP localhost.62815 > localhost.ddi-tcp-1: Flags [.], ack 189, win 12753, options [nop,nop,TS val 508646666 ecr 508646666], length 0
....E..4q.@.@............_".9e..&B....1..(.....
.QU
.QU

16:43:56.396245 IP localhost.62815 > localhost.ddi-tcp-1: Flags [.], ack 189, win 12753, options [nop,nop,TS val 508646666 ecr 508646666], length 0
....E..4q.@.@............_".9e..&B....1..(.....
.QU
.QU
```

Output from client:
```
Got response 200 with protocol HTTP_2
Got data response
Got response 200 with protocol HTTP_2
Got data response
```

**Comment by vietj** [comment]
this seems due to HTTP upgrade for H2 since this is not using SSL

**Comment by vietj** [comment]
fixed by https://github.com/eclipse/vert.x/issues/2519
